title,content
"uwinsite-guide.md part 4","Here, you can look at your grades by semester. Choose what semester you would like to view and you'll see a listing of the courses you took including the grades you recieved and the units/credits the course is worth. :::note units = credits. ::: An undergraduate student also has an option to submit a request to appeal a grade. If you are not satisfied with a grade you receive in any course, you should first discuss it with the individual instructor who assigned the grade. You should make every effort to resolve the issue with the instructor by outlining the reasons for your dissatisfaction and attempt to come to a mutually agreeable resolution. If you are unable to resolve the problem with your instructor, you may consider formally appealing your grade based on Incorrect Evaluation or Procedural Irregularity. Students who wish to appeal a grade in a course must submit a Grade Appeal through UWinsite Student no later than three weeks after the final grade has been posted. A letter of rationale and supporting documentation must accompany the appeal form along with an administrative fee of $20 (this fee will be refunded if your appeal is successful). An appeal for compassionate reasons do not have an administrative fee of $20. If you are unable to resolve the problem with your instructor, you may consider formally appealing your grade based on Incorrect Evaluation or Procedural Irregularity. Students who wish to appeal a grade in a course must submit a Grade Appeal through UWinsite Student no later than three weeks after the final grade has been posted. A letter of rationale and supporting documentation must accompany the appeal form along with an administrative fee of $20 (this fee will be refunded if your appeal is successful). An appeal for compassionate reasons do not have an administrative fee of $20. There are two types of appeals: Administrative appeal and Medical/Compassionate appeal. To submit an appeal: 1. Click the Appeal/Consideration button. 2. Click Create. 3. Select the appeal type as Administrative or Medical/Compassionate   Select the appeal type: Administrative if you are submitting an appeal based on incorrect evaluation or procedural irregularity   After you finish steps 58, click Pay Appeal Fee   Select the appeal type: Medical/Compassionate if you are appealing for extenuating circumstances or on other compassionate grounds. 4. Click Ok 5. Select whatever answer that suits your situation in the dropdown box  Grade appeal page 6. Upload any supporting documents you may have in the Supporting Details section 7. You may elaborate further about your appeal in the Detail Reason for Appeal box 8. Click Submit :::note Follow the instructions carefully. Once you have submitted a file, you can view it, but you can't make any changes. :::  Your Profile You can see your profile when you click the tile that's titled Profile on the mainpage of the UWinsite Student When you click on that tile, you can see your student ID on the top left corner of your screen. It's recommended that you have it memorized. It's also on your UWindsor student card."
"uwsa-club.md part 1","id: uwsaclub title: Becoming a UWSARatified Club sidebarlabel: Becoming a UWSARatified Club slug: /guides/uwsaclub  Last updated on 2022/07/26 Just want the instructions? Head over to the instructions section.  Why You Should Become a UWSA Ratified Club There are many reasons why you should consider becoming a UWSA ratified club. Whether you're starting a new club or thinking of taking your existing club to the next level, becoming UWSA ratified may be incredibly useful  Legitimacy Being a UWSA club means your group is officially recognized, and as such, your club gains legitimacy. Knowing that your club has as organization behind it helps move things forward with administration and helps to show your members that your club is 'real'.  Support Managing a club is hard, but managing a club without someone to go to is even harder. One of the great things about being a part of UWSA is the advice and support they can provide. Whenever you aren't sure about something or need administrative advice on how to run your club, UWSA is able to provide support.  Financials A common problem with clubs is finding a safe and reliable place to store club funds. UWSA allows all student groups to store their funds in the UWSA account, which eliminates this problem. You can deposit cash and cheques with UWSA to store the funds safely, and ensure they carry over year after year. There are two main ways to use the funds in your UWSA account: reimbursement and purchase orders.  Reimbursement The main way you'll be able to make use of your club funds is via reimbursement. This means you pay for something out of your own money, send a cheque request, and UWSA will send you the money. Cheque requests need to be approved by at least two of the three executives (President, Vice President, Treasurer).  Purchase Orders Sometimes, UWSA can make purchases on your behalf to avoid club members needing to pay out of pocket. This typically only happens for larger purchases. For example, if your group wants to spend $500 to get tshirts for group members, UWSA can purchase the shirts on your group's behalf (so long as your group has sufficient funds).  If you ever have any questions about UWSA group financials, send an email to vpfuwsa@uwindsor.ca  Ratification Instructions 1. Have three people to serve as the President, Vice President, and Treasurer of the group. 2. Have these three executives sign the UWSA signature form. 3. Collect the contact information of at least 10 additional members to be part of the club. This means at least 13 members total, 3 executives and 10 general members.   You may want to use something like Microsoft Forms or Google Forms to collect this info.   You should collect their name and UWindsor email. 4. Send an email to studentgroups@uwindsor.ca and uwsa@uwindsor.ca with the member contact information list, the signature form, and a short description of your club. 5. Allow up to a week to hear a response, if you don't hear anything then send a follow up email.  Resources  UWSA Signature Form  Student Groups Resources Page  Student Groups Policy and Handbook  Cheque Requesition Form  Tips to Make Your Club Successful"
"vpn-guide.md part 1","id: vpnguide title: VPN Setup Guide sidebarlabel: VPN Setup Guide slug: /guides/vpn  Many protocols or ports are blocked by the university firewall. This is why you may not be able to connect with NoMachine or SSH. If you’re connecting from home and anywhere outside or inside the campus, you have to connect via a VPN server to access resources and data on the campus private network. This is a guide on how to setup the VPN.  Download First download the VPN client for your respective machine.  Download for Windows and macOS  Authenticate with your UWinID and password on the university's GlobalProtect Portal to get to the GlobalProtect Client download links. After that, click the link that matches your operating system.  Download for Android and Chrome OS  Follow the steps in the app when prompted. Also check which Chrome OS Systems support Android Apps if needed.  Download for iOS devices  Follow the steps in the app when prompted.  Download for Linux  Install openconnect using the package manager for your Linux distribution.  After Downloading After downloading and opening global protect it will ask you for the portal address. securelogin.uwindsor.ca is for the CS servers and networklogin.uwindsor.ca is for everything else. You will then be asked to sign in with your UWinID (first part of your UWindsor email) and password. :::warning To connect with SSH or NoMachine you must use securelogin.uwindsor.ca as the portal address for the VPN, not networklogin.uwindsor.ca"
"wifi-guide.md part 1","id: wifiguide title: WiFi Guide sidebarlabel: WiFi Guide slug: /guides/wifi  This is a guide to connecting to WiFi on campus.  WiFi Networks available When you connect your wireless WiFi device (phone/PC/Mac) to the network, you will see the available wireless networks listed which you can try to connect to.  eduroam  uwinsecure  uwindsor Which should you use? The short answer is “Connect to eduroam”. The eduroam wireless network is available to all wireless users (Students/Faculty/Staff/guests). Plus it has the additional benefit that users from other eduroam institutions (many universities, for example) can also connect to the University of Windsor’s wireless network using their home institution’s crededentials.  Eduroam  The Preferred Wireless Network alt text Eduroam is a network used by many universities, and your UWindsor sign in will work at any campus that uses eduroam. 1. Open WiFi settings on your device and select the “eduroam” network 2. Depending on your device you will be prompted for different settings. Here is the list of all possibilities. Fill in any you see. (Most computers will only ask for Username and Password)  For Windows and iPhone <  EAP method: PEAP  Phase 2 authentication: MSCHAPV2  CA certificate: Use System Certificates (or leave blank if this is not an option) >  Identity (username): Your full UWindsor email (example@uwindsor.ca) <  Anonymous identity: Your full UWindsor email (example@uwindsor.ca) >  Password: Your UWinID password If prompted to trust a certificate after signing in (mainly iPhone) click trust.  For Linux and Android  WiFi Secuirty: WPA & WPA2 Enterprise  Authentication: Protected EAP (PEAP)  Anonymous Identity (username): Your full UWindsor email (example@uwindsor.ca)  Domain: uwindsor.ca  CA certificate: None  PEAP Version: Automatic  Inner Authentication: MSCHAPv2  Identity (username): Your full UWindsor email (example@uwindsor.ca)  Password: Your UWinID password The uwindsor wireless network is available for use but should only be used as a last resort. Unlike eduroam and uwinsecure, the uwindsor network does not encrypt the network traffic. So, for example, if you are accessing network applications using a protocol which is insecure, (eg. http instead of https), then everyone else using the uwindsor network in the vicinity could view your network activity. The wireless network called uwindsor is not secure.  For Residence Students While Eduroam is the primary campuswide WiFi network, you may want to use UWinResLife in your hall for heavier use (i.e. streaming or downloading). Sign in using your UWindsor ID (just the first part  not @uwindsor.ca), and your UWinID password.  Activating Your UWindsor Account You use your UWindsor ID to sign into your UWinsite Student, Brightspace, MySuccess, etc. Your UWindsor email address is your ID @uwindsor.ca and signin is via Gmail. To activate your ID, you will require your 9digit Student Number and 4digit Personal Access Code (PAC). Find these by searching your inbox, or on your acceptance letter. Visit the Leddy Library or the Computer Centre to use an internetenabled computer and activate your account."
"useful-links.md part 1","id: usefullinks title: Useful Links sidebarlabel: Useful Links slug: /usefullinks   Cheat Sheets and Docs  https://devhints.io/  Has some very nice cheat sheets for various things such as regex, bash, vim, and more.  https://regexr.com/ Extremely helpful website when taking classes that deal with regular expressions.  http://docs.gl/  Nicely laid out OpenGL API documentation.  https://crontab.guru/  Simple but helpful website for configuring crontabs  The Rust Programming Language  Detailed book on the Rust programming language.  EzTrackr  An opensource Chrome extension made by Harshdip Singh to help you organize your job search on a Trello board.  Tutorials  The Modern JavaScript Tutorial  Super indepth tutorial for modern JavaScript.  OpenGL Tutorial  Decent tutorial series on OpenGL including source code in the provided GitHub.  Net Ninja  Steven recommends any series from Net Ninja if you're looking to get into web development  The Odin Project  this program is good if you like doing projects alongside tutorials.  OSSU  has curriculum in many fields like computer science, data science, math, etc. If you have access to LinkedIn Learning, you can explore the tutorials there too.  Goodies As a student in Computer Science there are many free trials, offers, and products that are available to you.  GitHub Student Developer Pack  GitHub partners with a wide variety of companies and products offering credits, trials, and free software.  LinkedIn Learning  Computer Science students have access to LinkedIn Learning through their school account. You can also access it with a Windsor Library card.  1Password 6 Month Student Trial  Office 365  Windows 10  Education  Amazon Prime Student  Figma  allows you to create quick prototypes for your project  Spotify  3 months free  Windsor Transit  has semester passes for students."