title,content
"becoming-a-ta.md part 1","id: becomingata title: How To Become a Teaching Assistant sidebarlabel: Becoming a TA slug: /guides/becomingata  Last updated on 2023/09/07  What is a TA? A TA (Teaching Assistant) is a unionized student position where undergraduate students can work with instructors (often professors) to run University of Windsor courses. Instructors could ask for a TA's help in a variety of ways:  Holding Office Hours   Grade student assessments  Proctor Exams  Taking notes or answering questions during classes   A TA refers to an undergraduate student while GA (Graduate Assistant) refers to Graduate students  Why should you become a TA? Being a TA provides many benefits:  Work experience with a subject of interest  Create connections with Professors and Instructors  Further your own learning on the subject  Paid Position  The Collective Agreement As mentioned above, the position of a TA is paid. This rate of pay is determined in the CUPE 4580 Collective Agreement. This agreement is where you will find all detailed information about the position and its relationship with the University and the Union. To find the rate of pay in the Collective Agreement review Schedule 'A' in the current collective agreement 1. There you will find:  TA I  make $20.39/hour (As of 01/01/2021)   TA II (Year 3 and Year 4 Students) make $21.99/hour (As of 01/01/2021) Be sure to read your rights in the Collective Agreement, it is filled with important information about the position.    How to become a TA? To become a TA a student typically needs to have completed their first year of courses.  The processes will usually begin a few months before the start of the next term: | Term | TA Process Begins | Staring Month | |::|::|::| | Winter | October | January | | Spring | March | May | | Fall | July | September | The processes starts with an email from the department explaining which courses will require TA positions and how many positions are available. This email will cover which courses will have positions available and basic information about the positions like:  All courses and labs will be on campus (including some Distance Education courses that may require on campus office hours)  All GA/TA employees must make themselves available, and must be available for all assigned duties, both oncampus and online as required  Each GA position is expected to be for a total of 140 hours. A limited number of GA positions may be available for fewer hours  The total number of hours of a TA appointment will depend on the number of applications received and is anticipated to be 75100 hours per position. Note that Teaching Assistants can be employed for no more than 100 TA hours per semester total Once confirming that you meet the basic requirements for eligibility:  Successful completion of the course (80% minimum average) or demonstrated experience/knowledge in subject matter (which will be determined by interview)   Must have a minimum cumulative average of 75%. Must have a minimum major average of 80%  Must have excellent communication skills. Brightspace/Teams experience  Must be familiar with Brightspace and MS Teams or be able to acquire knowledge through training   Remote internet access requirements: Must have access to a computer with a reliable internet connection with video and audio capabilities   Or reviewing to see if you meet the preferred requirements:"
"becoming-a-ta.md part 2","Preferred qualifications will only be considered if there are 2 or more applicants who meet the required essential qualifications and who are relatively equal based on the criteria as per articles 12:03 or 12:04 of the CUPE 4580 collective agreement  Preference for TA positions will be given to applicants registered in a Computer Science program  Completion of CTL GA/TA Academy workshop (s) is an asset  Centre for Teaching and Learning (CTL) Brightspace Training completed You can begin the process by visiting the School of Computer Science Online GA/TA Application website 2 There are 5 pages to fill out, including your contact information, previous experiences, and top 10 courses ranked in order of your preferred placement. Once the form is submitted, if a successful candidate you will hear back from the University with an offer letter typically 14 weeks before classes begin. One important thing to note is the University has the right to change your position if needed. This means if you are offered to TA for one course and sign the contract, they could simply send you an email saying you have been reassigned to another course instead. To accept a TA position there are a few steps involved: 1. Reply to the email offer with a message accepting the offer   E.g. 'I accept this offer and confirm that I will be available to report for inperson duties in F/W/S term 20XX.' 2. Confirm you are enrolled in at least one course  3. Digitally sign the contract 3 4. Complete the HR hiring package   This will include signing multiple forms for the University's records like an offer letter, duties check list, Ontario Taxes form , Canadian Taxes form (TD1), and possibly more   Some forms will ask for an employee number, if this is your first time working for the University leave this blank and they will provide you with one on a later date. If you have an employee number but do not remember it, look at your employee profile on the University of Windsor Employee Site 4 5. Ping a Mod in the CSS Discord to give you the TA Role    This role will help students recognize you as a TA, giving you another space to help students   It could also assist you as a way to contact other TAs in case you have a further question about the process, or responsibilities involved Once you submit all of your paper work you must wait for confirmation from HR before beginning any work as a TA. You can communicate and meet with the instructor, however not begin any work until this confirmation is received.   TA Resources Once accepting a TA position there are (https://ctl2.uwindsor.ca/workshops/) 5 that are offered by the University that you can take to help you during your term. Some training courses are required, others optional. Most are one time only, meaning the next time you are a TA, you will not be required to do them again. You can also log into your University of Windsor Employee Site(https://myuwinfo.uwindsor.ca/default) 4 to see you payment information, completed trainings, T4, and other information.  Citations 1. Current Collective Agreement(https://www.uwindsor.ca/humanresources/sites/uwindsor.ca.humanresources/files/20192022cupe4580collectiveagreement.pdf)   University of Windsor Collective Agreements Page (For Future Agreements)(https://www.uwindsor.ca/humanresources/526/collectiveagreements) 2. School of Computer Science GATA Application(https://forms.myweb.cs.uwindsor.ca/modules/formbuilder/published/tagaapplication.php)   University of Windsor GATA General Information(https://www.uwindsor.ca/faculty/recruitment/341/graduateassistantsteachingassistants) 3. How to digitally sign a contract(https://www.uwindsor.ca/graduatestudies/1236/addingdigitalsignaturepdffillableform) 4. University of Windsor Employee Website(https://myuwinfo.uwindsor.ca/default)"
"contributing.md part 1","id: contributing title: How To Contribute sidebarlabel: How To Contribute slug: /guides/contributing  We're so thrilled that you want to help out with the UWindsor Computer Science Student Wiki Project This article will contain everything you need to know to start updating existing articles, writing your own articles, and using GitHub to get your code merged into the main codebase  Setting up Your Local Environment  Prerequisites You'll need to install some prerequisite software before contributing to the wiki (git, nodejs, yarn). Full instructions can be found on the wiki's README.  Running the Development Server Once you've installed all the prerequisites, you're ready to run the wiki locally Simply run `yarn start` in your terminal, and the wiki should automatically open up from the address http://localhost:3000/wiki/. You can now edit the content of any article and see it automatically change in the browser  Updating Existing Articles The simplest way to contribute is to add to or update an existing article. To do this, simply find the relevant `.md` file for the corresponding article you'd like to update, and edit the contents. That's it After you edit the content you should be able to see it change in the browser.  If the article you're updating contains a 'Last Updated' date at the start of it, make sure to update it with the current date Make sure to also follow the style guide and article requirements when updating an article.  Creating New Articles Creating new articles is a bit more complex than updating existing ones, but if you follow the pattern of other articles, you'll catch on quickly. The first thing you need to consider is where your article should be located on the wiki, and where it should be located in the actual code. Luckily, the layout of files and folders in the wiki codebase usually follows the layout of the site itself. So, if you wanted to create a new `guide` article, you'd create a new `.md` file under `resources/guides`. When opening up any of the existing markdown files, you'll probably notice that each one starts off with a section that looks like this: ```md  id: contributing title: How To Contribute sidebarlabel: How To Contribute slug: /guides/contributing  ``` Including this top section before beginning your article is vital if you want it to show up on the wiki. Each field is fairly self explanatory, but here's a quick rundown anyways:  id: This is a descriptive string that uniquely identifies your article. It's useful for sidebars.  title: The title of your article, this is automatically rendered as an `h1` at the beginning of your article.  sidebarlabel: Self explanatory, shows up on the sidebar to link to your article.  slug: This refers to what is appended to the url when going to your article. Slugs are expected to adhere to a format featuring all lowercase letters and hyphens between words. For example, if you're creating a guide about 'Topic A', you might make the slug `/guides/topica`. File names should follow the same naming scheme. Once you have this section completed, you now need to edit the relevant `XXXX.sidebars.js` file to create a link for it in the sidebar of whatever section you're writing the article for. For example, if you're creating a new guide you would update `resourcessidebars.js`. Look for items near where you'd like to place your article: ```js items:   ...  'guides/styleguide',  'guides/contributing',  ... , ``` Here, you can see that to add a new guide, you'll need to add an item here. If your article has an id of 'someID', you'll add the following: ```js 'guides/someID', ``` If, say, you wanted to add an article about CSS, you'll notice the sidebars file is a bit different:"
"first-year-guide.md part 1","id: firstyearguide title: First Year Guide sidebarlabel: First Year Guide slug: /guides/firstyear  last updated on 2022/09/06 This guide is intended to help incoming first year students prepare for a computer science degree at the University of Windsor. It addresses some general information about being a student at the University of Windsor and provides resources specifically to help students succeed in computer science courses.  Getting Started at the University of Windsor  UWin Accounts Every student must have a UWin Account in order to access the university's online services. Instructions to set up your UWin account will be sent to your personal email after you've been accepted into a program at the university. You will be assigned a UWin ID and will create a password during this process; these will be used as your login information. Your UWindsor email will be yourUWinI@uwindsor.ca.  Online Services Some of the online services you can access using your UWin Account include:  UWinsite Student For browsing and enrolling in classes, viewing tuition and fees, accessing acedamic information, applying for scholarships, and more. See the UWinsite Guide for more details and help.  Brightspace The university's Learning Management System (LMS). It is used to view course material, submit coursework, review grades, and more.  Microsoft Office 365 All University of Windsor students have access to a full suite of Microsoft Office 365 tools and software, including Outlook for email services and OneDrive for 1 TB of free cloud storage. A Microsoft Account is automatically created using your UWindsor Email and UWin Account Password. See this FAQ for more details.  Enrolling in Courses  Which Courses to Take :::important These wiki resources are maintained by student contributors. Always verify important academic information with a primary university resource or an academic advisor. ::: There are several computer science programs offered by the University of Windsor, each with their own course requirements which can be found in the undergraduate calendar. If you follow the recommended course sequence, many programs will share the same courses for the first term. They are COMP1000, COMP1400, MATH1250 (or MATH1260), MATH1720 (or MATH1760), and an elective. See the Courses section for a userfriendly table of course requirements by program.  How to Enroll Incoming first year students typically have the earliest appointment time and may enroll in courses before all other students. Your appointment time can be found on UWinsite under My Academics > Enrollment Deadlines. It is recommended to enroll as early as possible, as courses have a limited capacity and desireable timeslots fill up quickly. See the UWinsite Guide for more details on how to enroll in classes.  Recommended Software for Computer Science As a computer science student, you will learn to program in a variety of programming languages, starting with the C Programming Language in COMP1400. Installing and familiarizing yourself with the necessary software on your personal computer before the first day of classes will save you time and stress, especially if you are new to programming. All of the following software can be downloaded for free.  Code Editor: Visual Studio Code  Description A code editor helps a programmer write code (like Microsoft Word but for programming). Code can be written in any text editor, but a good code editor will provide features like syntax highlighting, basic error checking, and autocompletion for several programming languages. Note that a code editor is not an IDE (integrated development environment). For example, Visual Studio is an IDE while Visual Studio Code is a code editor and a seperate piece of software. An IDE will typically provide builtin tools to run, debug, and examine your code for a specific language, while a code editor will not (or will require you to install additional tools to do so)."
"first-year-guide.md part 2","Visual Studio Code (VS Code or VSC) is recommended in this guide. It provides builtin support for several programming languages, including C, and hundreds more are supported through downloadable extensions. It is recommended over an IDE for two reasons: (1) its portability to other programming languages and (2) it forces students to learn how to transform code into an executable program using the command line.  Installing Windows, Mac, and Linux downloads are available on the official website. Instructions for each operating system can be found with a quick web search if needed.  Resources  First Year Bootcamp  Setting up VSCode Workshop: a workshop hosted by CSS to get VS Code up and running on Windows. Note that this workshop also provides a way to install a C compiler using MinGW, which is an alternative way to the one recommended in this guide, using WSL. MinGW is not needed for VS Code itself, and can be skipped in favour of WSL (see the next section).  Windows Subsystem for Linux (Windows Only)  Description Linux is the preferred operating system for many programmers. It is also the operating system found on the School of Computer Science's servers and computers, which you will need to use for class work and verifying code compatibility (code written on one system may behave differently on another system). For these reasons, it is recommended that students familiarize themselves with the Linux environment. Recent versions of Windows have made it easy to work in a Linux environment within Windows, rather than having to run it in a virtual machine or as a secondary operating system. This is done using Windows Subsystem for Linux (WSL).  Installing The official WSL guide provides more details about WSL, its features, and how to install it. However, enabling and installing WSL on the most recent versions of Windows (Windows 10 version 2004 or higher, or Windows 11) is now as easy as typing the following command in an administrator command prompt or Windows PowerShell window, which can be found be searching in the start menu for either and right clicking the icon to select Run as administrator. ``` wsl install ``` :::note By default, this command installs Ubuntu as the Linux distribution, which is popular among those new to Linux. If you are interested in other distributions, see the guide. ::: On older version of Windows 10, you can install WSL manually. Once WSL is installed, you can start it in a command prompt or PowerShell window by entering `wsl`.  Getting Started The first thing to do on a fresh install is to update any out of date software. A Package Manager makes this easy on Linux: it's like the app store on your phone, but for all of the software on your computer. On Ubuntu, the default package manager is apt. You can update everything at once using the following commands. ``` sudo aptget update && sudo aptget upgrade ```  Shell: Bash, Zsh, or many others  Description A shell is used to interact with your system and run programs using text commands. It is often favoured over or used alongside a graphical user interface (GUI) environment by programmers. Windows running WSL, Mac, and Linux each can use a different default shell, but all Unix shells will share the same basic commands.  Installing On Windows, see the WSL section. A shell will be installed with your distribution of Linux. On Mac, use the 'Terminal' app.  Getting Started Typically, a shell will display some information before your cursor, though the format can differ. In this example, everything up to and including the dollar sign is information provided to you by the shell about you and your system. ```sh username@computername foldername/or/path$ echo 'Chip says hello' ```"
"first-year-guide.md part 3","The following are some basic commands:  `ls` will list the contents of the current folder.  `cd folderName` will move you to the folder named 'folderName'.   `cd ~` will take you to your Home folder.   `cd ..` will take you back out of the folder you are currently in.  `echo 'Chip the Cool Cat'` will display 'Chip the Cool Cat' in your terminal.  `cat fileName` will display the contents of a the file named 'fileName'. Some tips:  You can scroll through your command history using the up and down arrows.  ctrl+c can be used to kill a process that is running in your shell.  C Compiler: GCC  Description When you write C code, you need a way to make it executable on your system. This is where a compiler comes in: it reads in the more humanfriendly C code and outputs a program that your computer can read and run. GCC is the compiler you should use when developing C code for your classes, unless your professor specifies otherwise. When you compile code using a different compiler, or on a different system, your program may behave differently than it will on the school's system using GCC. For this reason, it is also sometimes recommended that you double check your programs on the School of Computer Science's systems before submitting more complicated assignments.  Installing On Windows running WSL with Ubuntu , enter the following into your shell: ``` sudo aptget install gcc ``` On Mac, this video provides one way of installing GCC, as well as the Homebrew package manager.  Getting Started This section will help you create a sample C program, compile it, and run it. Copy and paste the following code into a new file on your system. Call it 'hello.c' and remember where you save it. ```c include <stdio.h> int main(void) {  printf('Chip says hello'); } ``` Find the file in your shell. For example, if you put the file on your Desktop, use the following command to go to there. ```sh cd ~/Desktop ``` Compile the program into a binary (runnable file, executable, etc.).  `Wall` tells the compiler to output all warnings.  `o hello.out` tells the compiler to save the created binary with the name 'hello.out'. ```sh gcc Wall hello.c o hello.out ``` Run the binary you just created. ```sh ./hello.out ``` The output should be ``` Chip says hello ```  Remote Connection: SSH and NoMachine  Description As a computer science student, you have access to the School of Computer Science's servers, which provide software in a Linux environment that you are free to use. On campus, they can be accessed using School of Computer Science computer labs. Remotely, they can be accessed in several ways.  SSH (recommended): Remotely use a shell on the server.  NoMachine: Remote desktop environment. :::important  You must authenticate your UWin account with the School of Computer Science before you can log in remotely.  To log in remotely from offcampus, you must be on the VPN first. Please refer to our guide on how to set up the VPN here. :::  SSH In a shell, use the following to connect to the school's servers. Replace 'UWinID' with your UWinID. ``` ssh UWinID@cs.uwindsor.ca ``` For example, if chipcoolcat@uwindsor.ca wanted to connect, they would use the following command. ``` ssh chipcoolcat@cs.uwindsor.ca ```"
"laptop-guide.md part 1","id: laptopguide title: Laptop Requirements Guide sidebarlabel: Laptop Requirements Guide slug: /guides/laptop  Last updated on 2022/08/24 Here are a few things to keep in mind when purchasing/configuring your laptop:  Hardware Although the following specifications are not strictly required, having these minimum specifications will make your computer less frustrating to use:  8 GB of RAM   for gaming/futureproof purposes, 12 or 16 GB is more preferable  256 GB of SSD storage   UWindsor provides 1 TB OneDrive cloud storage. However, it is strongly recommended that you upgrade to at least 512 GB. This will allow you to have space for a lot of games and software, and the extra local storage is good if you don't want the hassle of constantly uploading and downloading files from the cloud.  Operating System You aren't required to have certain OS since the School of Computer Science has remote Linux server that you can connect to, but here are a few pros and cons to help you decide which OS to use:  Windows Windows is one of the most popular OS among students, particularly because it comes with most preassembled laptops. The user interface should be fairly intuitive even when you are new to using laptops, and it is one of the most supported OS for app availability or IT support. Additionally, it is much easier to game on Windows. Many Computer Science classes (COMP1400 and COMP1410, for example) will require programming environments that are harder to set up in Windows than in other UNIX/Linuxbased OS. Although substitutes like WSL can help, you might run into compatibility issues when working with sockets and pipes in classes like COMP2560. Virtual machines shouldn't have compatibility issues, but they can require a lot of computing power, especially when GUI is involved. Should you choose Windows as your primary OS, you should consider setting up an SSH connection to the UWindsor's remote server on editors like Visual Studio Code or via other means. In addition, when you are working with other developers on a project, you may also have to pay attention to your line breaks (CRLF vs. LF). If you are taking classes offered by other faculties or departments (e.g. Engineering), you may have to install software that are only available on Windows. However, this usually is not a concern since such instances are quite rare, and the University of Windsor has many other computer resources to help you out if something like this happens.  Linux Linux/UNIX is very good for programming/developing because of how easy it is to set up the necessary environment. Much like MacOS, it can be difficult to game on. Depending on how important gaming is to you, you may need to use Wine, set up a virtual machine, or dualboot with Windows. Additionally, since many of the University's software (Office 365, OneDrive, Teams, etc.) are on the Microsoft platform, there may be some compatibility issues. Popular Linux distros include Ubuntu, Debian, Fedora, Pop_OS, Linux Mint, and Arch Linux. If you are very new to Linux, then Ubuntu and Debian may be a good starting point for you simply because there is a large community using them and most likely have answers for any problem you encounter. The University, for example, uses Debian on its remote servers. If you have time and are willing to experiment, you should test out the different Linux OS since the desktop environment on Ubuntu and Debian (GNOME) can be slightly laggy on laptops without high specifications. If you are coming from Windows, Linux Mint's Cinnamon desktop environment will help you adjust to Linux as it has a look and feel comparable to that of Windows."
