title,content
"laptop-guide.md part 2","Although Linux OS may be confusing for new users, becoming comfortable with a UNIX/Linux environment is very beneficial for you. The University generally expects you to produce code/projects that will work on its Linux server. As well, Linux forces you to interact with the command line more, which is great if you want to learn more about how your computer works underneath. Almost all Linux distros are free, especially the popular ones. In general, Linux distros require less disk space and perform better on lowend devices, compared to Windows. Thus, the right Linux distro will significantly optimize your laptop, especially if you are on a budget. However, Linux is also generally worse for battery life compared to other OS.  MacOS Since the MacOS is a UNIX operating system, it is usually easier to set up local programming environment than Windows. As well, it is also among the most supported OS in terms of IT support and app availability. However, MacOS is generally not compatible with nonApple products. This means that you would need to purchase a MacBook to use MacOS, which may be expensive/less costeffective depending on your budget and what specifications you're looking for. Much like Linux OS, it can be difficult to game on. Depending on how important gaming is to you, you may need to use Wine, set up a virtual machine, or dualboot with Windows.  ChromeOS (Chromebook) The ChromeOS is a Linuxbased operating system derived from the Chromium OS. However, ChromeOS is generally not compatible with nonChromebook products. Although Chromebooks are typically lightweight, portable and have good battery life, you usually cannot install much on them since they generally have low specifications. Although you can set up programming environments on them using a Linux container, having a low hardware specifications may decrease the performance. As such, Chromebooks (or other laptops like Surface Pro) are best used for doing quick works on the campus while having a more powerful desktop/laptop at home.  Battery Life and Portability Battery life and portability are probably the most important factors that you should think about when purchasing a laptop. You should purchase a laptop that has decent battery life and is reasonably light. Alternatively, you can look for ergonomicallyengineered laptop bags that can store your chargers so that you won't get hurt as you exercise around the campus. Some factors, like a laptop's hardware, may affect its weight and battery life. Powerful CPUs, for example, often drains battery quicker. Extremely small and lightweight laptops often have smaller fans and vents and thus heat up easily, which can also reduce battery life. It is therefore important to research about your laptop choices and test them in person before making a purchase.  Screen Size Common screen size range from 13' to 17', but it is recommended to keep your selection between 13'' to 15'' for portability. If you are looking for a more portable laptop, then 13'' will be a better choice. However, this also means that you will see less content on the screen at a time, especially when you make the fonts bigger for ergonomic purposes. On the other hand, a 15'' laptop can display more content but are also heavier and thus less portable.  Other Features Although features like 2in1 and touchscreen are very useful for purposes like digital art, they may not be very useful on the campus other than taking digital notes. If you are purchasing a laptop that is going to mostly be used on campus, then you can subsitute with a drawing tablet to save money."
"parking-guide.md part 1","id: parkingguide title: Parking Guide sidebarlabel: Parking Guide slug: /guides/parking  Last updated on 2022/06/10 This is a guide to the parking spaces around the campus. See this map if you would like to see the different UWindsor buildings beforehand.  Official UWindsor Parking Spaces There are 17 official parking lots within the UWindsor campus. This includes visitor parking, staff parking, and student parking. You can locate these parking lots in this campus map. a map outlining official uwindsor parking spaces for students, staff, and visitors  Student Designated Parking Student parkings in UWindsor are either payanddisplay, permitonly, or both. Most student parkings are located around Alumni Hall, with a few more parking locations in Leddy, Cartier Hall, Assumption Hall, and the downtown campus. To obtain a student permit, visit the UWindsor Parking Online Services. Permits are either 8 months or 12 months (for Fall & Winter), or 2 months or 4 months (for Intersession & Summer). :::note While some of these locations (such as the Parking Garage) do not accept cash, some other parking locations (like Leddy special night parking) are coin entry only. For places where student permits and payanddisplay options are both allowed, you do not need to pay if you already have a student permit, but you must display your permit on your vehicle when parking. The hourly rate for parking is $2.00/hr, up to $10.00 maximum per day. As well, even if you have a student permit (or parking pay stub), you must follow the University's parking regulations. The University will fine or, whenever necessary, tow your vehicle if they discover that you have violated the regulations. :::  Visitor Parking Space Visitors are able to use the Parking Garage and the designated visitor parkings around the area. Unlike students and staff, visitors cannot buy semester/year parking passes. Instead, visitors must pay a parking rate by the hour, by the day, by the week, or by the month. However, the University also provides vendor permits in the student parking lots.  Accessible Parking The University of Windsor will provide accessible parking to people who requests parking spaces. If you require accessible parking or any other accommodations, make sure to contact the Campus Parking Services and the Office of Human Rights, Equity and Accessibility. They will work with you to make sure that your requests will be fulfilled to the best of their abilities. Campus Parking Services  Location: Joyce Entrepreneurship Centre, 1st Floor  Hours of Operation: Monday  Friday, 8:00 a.m.  4:00 p.m.  Phone: (519) 2533000 Ext. 2413  Email: parking@uwindsor.ca Office of Human Rights, Equity and Accessibility  Location: Chrysler Hall Tower, Room 325, Reception  Hours of Operation: Monday  Thursday, 8:30 a.m.  4:30 p.m.; Friday, 8:30 a.m.  12:00 p.m.  Phone: (519) 2533000 ext. 3400  Email: ohrea@uwindsor.ca  Unofficial Parking Spaces There are many other parking spaces around the University of Windsor, mostly along Huron Church, University, Wyandotte, Sunset and Patricia streets. If there is a parking meter, it is usually payable by coins. However, you can also pay via the mobile app Passport Canada. The hourly rate for parking is $2.00/hr, and there is no parking fees when you park during the afterhours (after 6:00 p.m. on MonSat, or during Sundays and holidays). a map showing the City of Windsor street parkings around the University of Windsor campus The detailed version of the street parking map can be accessed here. :::note While many of these parking spaces are accessible to students, it must be noted that some of these parking spaces are available only to the residents nearby; any vehicles parked there must present a residential parking permit to not be fined or towed. :::  Accessible Parking"
"student-exchange-guide.md part 1","id: studentexchangeguide title: Student Exchange Guide sidebarlabel: Student Exchange Guide slug: /guides/studentexchange  Last updated on 2022/08/08 Jose thinks exchanges are fun and 100% worth it. The Exchange Coordinator, Michelle, is a fantastic and knowledgable person and can help you with any concerns/questions. You can hear about Jose's experience here:  Jose's University of Essex Experience In addition, you can also watch this series of UWindsor video clarifying some information about Student Exchange, or you can contact Michelle Bondy.  Open Office Hours with Michelle  Eligibility Requirement When you apply to go on a student exchange, the following requirements are considered. These requirements aren't set in stone, however, and you may still be considered during special circumstances or if you can satisfy the requirements in some other way.  Be enrolled in a UWindsor degree program during the exchange.  Have a cumulative average of 72%+ at the time of application.  Be in good academic standing.  Have completed two years (~20 courses) worth of Universitylevel education before exchange.  Proficiency in second language (when the host institution does not teach in English). In addition, you must follow these exchange policies as CS students:  You can only exchange for up to one academic year per degree program.  You must have a full course load (as defined by the host institution) during the exchange.  You will not normally be eligible for refund of tuition if you withdraw from exchange before completing the current semester.  If you took classes recognized for credit by the host institution for their students, then these classes will be recognized for credit by UWindsor. The opposite also applies.  Your grades in these courses will be transformed into UWindsor grades.  Exchange Destinations Students in Computer Science programs can go to different destinations of exchange depending on the program/host institution applied for. Usually, each program/host institution has only 14 spots for exchange. This number of spaces, however, can change depending on the agreements made between the University of Windsor and the host institution. Since not all spaces are available every year or every semester, it is strongly recommended that you check the Destination by Major and Current Available Destinations before you apply for your destination of choice. Depending on the host institution, you may be required to prove proficiency in the language that the institution teaches in. As for now, the following destinations available to CS students teach in a language other than English:  France  Germany  Italy  Mexico In such scenario, you may need to take a language assessment with the Languages department as arranged by the Exchange Office.  Exchange Expenses Here are some expenses that you should consider before going on an exchange:  Tuition and ancillary fees   UWindsor students will continue to pay their normal UWindsor tuition and ancillary fees, and no tuition/application fees are charged by the host institution.   Student association fees, however, are waived.   UWSA supplementary health insurance are charged, but students can still optout.  Travel and accommodation/living costs   These costs will also include costs for visa, passport and other travel documents.   The host institution can help students find accommodations, generally in the forms of student residence and meal plans.  Insurance   Students must purchase health insurance, in addition to OHIP, appropriate for the country of destination.   The host institution may provide this insurance for students to purchase. The University of Windsor has a page detailing some of the financial assistance you can receive for exchange. Students can also apply to the University of Windsor International Mobility Award. In addition, the Government of Canada and Ontario has programs to provide financial aid for students studying abroad."
"student-exchange-guide.md part 2","Sometimes, your country of destination may also provide financial aid programs for students studying in their country. If your country of destination allows international students to do parttime work, you may also work during exchange to cover a part of your expenses.  Application Process Students interested in applying must have these components in their application:  Exchange Online Application  Three Reference Letters/Forms   The form must be completed and returned by the references, not the student.   One of the three references must be a UWindsor faculty member who has taught the student in a class.  Language Assessment (if applicable) After applying, you may be interviewed by the Exchange Office to determine your interest in the exchange program. The Exchange Office has a selection committee who will review the applications, interview the applicants, and rank candidates based on the following criteria:  Seriousness of interest   This can be demonstrated in the depth of research you showcase about the school(s) you applied for.  Suitability of the host institution’s program for degree requirements  Ability to be a good ambassador and representative of the University and the city while away  Interesting classes you noted when making your application for exchange   You are not expected to make a class schedule when applying for exchange, but this is a nice bonus point.  Personal adaptability  Participation in university and community life  Academic ability The interview may be conducted in a second language if the school(s) you applied for does not teach in English. In addition, the interview is a great opportunity for you to ask some questions you have about the exchange.  Important Deadline :::important You should send in your complete application (including the language assessment and reference forms to be sent by the references) before the specified deadline to get priority when considered for exchange placements. Although late applications are still accepted, late applicants are only considered when there is remaining space and time. :::  January 15th (before 3 pm)  application deadline for students beginning exchange in September (1 or 2 semesters)   Applications are usually available around midOctober.  September 15th (before 3 pm)  application deadline for students beginning exchange in January (1 semester)   Applications are usually available around late June. Generally, students are recommended to apply during their second year and begin exchange during their third year to allow for flexibility in course selection when studying abroad. To ensure that your graduation is not delayed, you should consult with your academic department/advisor about the interest you have for the exchange program. :::note Students going on exchange in their final semester may have their convocation delayed due to the time needed to process transfer credits."
"uwinsite-guide.md part 1","id: uwinsiteguide title: UWinsite Guide sidebarlabel: UWinsite Guide slug: /guides/uwinsiteguide  Last updated on 2022/06/25 This is a guide on how to use and access the important sections on your UWinsite Student page.  Course Management  How to Plan & Enroll in Classes To plan your courses and register in classes in UWinsite Student, you will use the Manage Classes section on the Student Homepage.  Planning your Classes You can start planning your classes and adding them to your Shopping Cart in UWinsite Student when the validation period opens. The validation period is when the timetable for the next semester is close to final and the courses being offered are visible in UWinsite Student. Typically, the validation period starts two to three weeks before registration begins. The preferred method for placing your classes into the Shopping Cart is through Class Search and Enroll. This method shows you just the courses that are offered during the term for which you are planning. To get started planning your classes: UWinsite homepage 1. On the Student Homepage, click the Manage Classes tile. 2. Click the Class Search & Enroll tab in the left navigation menu.  Class search and enroll page 3. Select the term in which you will be registering. 4. In the Search for Classes field, enter a subject area, topic or course code. 5. From the Search Results, select a course. 6. On the Course Information page you will see all class sections for the term you  selected. Some classes have one section while others have multiple sections. Under  Class Selection, you can view the time, date, instructor, location and available seats  for each section of the class.  Course info and class selection page 7. Select a class section. You can click anywhere on the class except for the Lecture or  Lab link to select it. 8. You’ll now be directed to the confirmation process:  1. Review Class Selection and click Next  2. Review Class Preferences   This is where you have the option to add yourself to the waitlist if the class is  full. Select Yes if this will not put you in course overload (normally 5 classes, but  check your program).   Select No if having this course on the waitlist would put you in course overload.  You will instead need to use Swap Classes so UWinsite Student knows what  course to drop if you are to reach the top of the waitlist.  3. Click Accept  4. On the Enroll or Add to Cart page, click the Add to Shopping Cart button and  then click Next.  5. On the Review and Submit page, review your selections and then click Submit.  Registering in your Classes Registration at UWindsor is by appointment time. Registration appointment times are assigned based on a number of factors including program and level of study. Your registration appointment time is assigned based on several factors including program and level of study. Your registration appointment time is when you can start to register. It is important to register early to have a better chance of getting into the classes that you want to take. Registration does, however, remain open until the tenth day of classes so you may make changes to your courses so long as there is space. Once registration appointment times are assigned for a term, you can find yours under My Academics > Enrolment Deadlines. Your registration appointment time will also be sent to your UWindsor email account. When your registration appointment time opens:"
"uwinsite-guide.md part 2","1. On the Student Homepage, click the Manage Classes tile. 2. Click the Shopping Cart tab in the left navigation menu. 3. Click the radio button next to each of your preferred classes and then click the Enroll button.   If you are successfully enrolled in a class, you will see a green check mark beside it.   If you are not enrolled in a class, you will see a red X beside it. 4. There are several reasons why you might not be successfully enrolled in a class:   The class is full.   There is a time conflict   Enrolment in the class is restricted for various reasons. For example: it is reserved  for students in particular majors or levels of study.   You may be missing a prerequisite (this should not be the case IF you validated  your classes).  Financial Information  Financial Account In this section, you'll find:  Your account balance including what you owe, charges, deposits and anticipated aid  Payment history  Account services  Account Balance Account balance page The first tab on your left will be your Account Balance. You can see the amount balance due now without clicking on it. If you want to see a detailed breakdown of what you owe, click on the Account Balance Due Now tile on the left of your screen. You'll now see what you owe broken down by fees per semester. Here, you can see what Charges & Deposits have been made to your account. The amount you see in the Pending Financial Aid is what you'll recieve in financial aid from OSAP and/or scholarships when the funding gets approved. You can also request a certain statement depending on what you select in the term box. The Current selection will give you the summary of all outstanding charges regardless of term. A term specific statement will only give you a summary of all outstanding charges of that said term. To generate a statement of your charges, click the Print Student Statement box. You'll get a PDF file of the statement.  Charges Due The next tab on the left: Charges Due will allow you to view your charges and what you owe by two methods. In the Summary By Due Date section, you'll see a breakdown of any charges you owe and the date they are due. In the Detail Of Charges Due section, you'll see the description of the fees you owe, the charge date, the term and the charge amount.  Account Services The Account Services tab on the left has four subcategories:  Charges Due: provides a summary by due date of the charges and deposits that you owe  Opt Out Drug and Dental: gives you the option to opt out of your drug and dental insurance  Income Tax Forms: allows you to request an income tax T2202A or T4A form by selected year.  Income tax forms page  1. Select a year  2. Click the dropdown arrow to select an income tax form type  3. Click on download  Online Refund Request: allows you to request a refund form from the university  Academics  My Academics Here, you'll see your Academic Summary, Enrollment Deadlines, Student Evaluation of Teaching, a Change of Program Application, a Returning Student Application, Service Letters, and Apply to Graduate  Student Academic Summary Your summary is broken down into your academic structure. It'll give you a rundown of what you're studying at the University. This section goes into detail regarding your term and when you're expected to graduate."
"uwinsite-guide.md part 3","Further down, you'll see your term summary. You can click on the term you wish to view in detail and it will give you the option to add or change a minor. You can also view the details regarding the number of credits of any courses, you dropped, waitlisted, or that you're currently enrolled in.  Enrollment Deadlines Here, you can view your appointments and enrollment dates for another term including the session, when the appointment starts, and the last date to enroll.  Change of Program Application Here, current students can change their programs and this is also for students who applied for parttime studies who wish to apply for fulltime studies. You'll also see the deadlines of the application for each term. To start a change of program application: 1. Click Create New Application. You will see a variety of areas that need to be completed. 2. Now, click the Application Start button which you may need to scroll down to see.  Change program application page 3. Then, complete the required fields on the page. 4. Once you complete a page of your application, click the Save button to save what you've filled 5. Click the Continue button to proceed to the next page and do the same until all pages have been filled. 6. When you complete your application, click Submit Application :::note Make sure you save your application often. You can also save what you've currently filled and come back another time to complete the rest of your application. :::  Returning Student Application This form is for inactive students. It functions the same way as the Change of Program Application.  Self Service Letters You can request a variety of self service letters in this section:  Attestation Letter: If you're a student travelling outside of Canada and need a letter to prove the University of Windsor is an accredited institution, you'll request an attestation letter  COOP Letter: Allows international students to apply to be eligible to work during their duration at the University of Windsor  Enrollment Verification Letter: Is a student's proof of registration. It shows a student's current status and prjected completion date  Gradutation Letter: Students who have applied to graduate and have successfully completed their program requirements will recieve a graduation letter  Student Snapshot: A current view of a student's enrollment status  Academic Progress In this section, you'll be able to see your Academic Progress Summary, Program Requirements, and your Whatif Report.  Academic Progress Summary This tab shows you the graphical representation of your academic progress.  Academic Progress This tab gives you an indepth look at your academic progress. Academic Progess breaks down your program requirements. You will be able to view bar charts showing the completion level of your program requirements.  Whatif Report The Whatif Report allows you to view what requirements you need to fulfill if you decided to switch programs. To run a Whatif Report: 1. Click Create New Report in the View Whatif Report tab.  Whatif report page 2. Then you choose your Career followed by your Academic Program, then your Area of Study, and then your Concentration. 3. After that, click Browse Course Catalog. 4. Then select Subject Codes for inclusion in your course whatif report. 5. Now, click Submit Request. The system will generate a response based on your choices. You will be provided with what course will be required and what courses do not fulfill your academic program requirements.  Academic Records  Course History Course History allows you to view the courses you have completed, transferred from, are planning to take, and that are currently in progress. You can see the status of each of your courses on the right hand side.  View Grades"
